{
  "id": "ext.key",
  "title": "Send key press",
  "description": "Sends a single key press or key combination",
  "schema": {
    "type": "object",
    "required": ["key"],
    "properties": {
      "key": {
        "type": "string",
        "description": "Key to press (e.g., Enter, Escape, Tab, F1-F12)",
        "examples": ["Enter", "Escape", "Tab", "Space", "F1"]
      },
      "modifiers": {
        "type": "array",
        "items": {
          "enum": ["ctrl", "alt", "shift", "meta", "cmd"]
        },
        "description": "Modifier keys to hold while pressing"
      }
    }
  },
  "capabilities": ["web"],
  "prerequisites": ["ext.open_url"],
  "cost_estimate": {
    "llm_tokens": 0,
    "api_calls": 0,
    "execution_ms": 300
  },
  "platforms": ["windows", "mac", "linux"],
  "version": "1.0.0",
  "author": "AutoWorkflow",
  "tags": ["keyboard", "input", "web"]
}